SponsorName,SponsorCTDS,SiteName,SiteCTDS,SponsorEntityID,SiteEntityID,PgmPart,Enroll,lowincome
A New Leaf,072122000,Alice Peterson Residence,072122007,7320,80290,Regular or Provision 2/3 Base Year,10,0.8000
A New Leaf,072122000,D Mitchell RES,072122002,7320,7322,Regular or Provision 2/3 Base Year,20,0.8000
"Academy Del Sol, Inc.",108734000,Academy Del Sol,108734001,90199,90200,Regular or Provision 2/3 Base Year,580,0.7200
"Academy Del Sol, Inc.",108734000,Academy Del Sol - Hope,108734002,90199,90770,Regular or Provision 2/3 Base Year,93,0.7200
"Academy Of Excellence, Inc.",078604000,Academy Of Excellence,078604101,4296,5461,Community Eligibility Provision,92,0.9500
"Academy of Mathematics and Science South, Inc.",078242000,Academy of Mathematics and Science South,078242001,90878,92197,Provision 2 Non-Base Year,560,0.8700
"Academy of Mathematics and Science, Inc.",108713000,Academy of Math and Science,108713101,79961,79094,Regular or Provision 2/3 Base Year,476,0.6300
"Academy of Mathematics and Science, Inc.",078270000,Academy of Math and Science Camelback,078270001,92768,92769,Provision 2 Non-Base Year,937,0.8800
ACCEL,072164000,ACCEL Metro Campus,072164001,7355,7356,Regular or Provision 2/3 Base Year,161,0.5700
Acclaim Charter School,078701000,ACCLAIM Academy,078701101,4325,5496,Regular or Provision 2/3 Base Year,373,0.9000
Acorn Montessori Charter School,138760000,Acorn Montessori Charter School,138760101,79437,79438,Regular or Provision 2/3 Base Year,319,0.7000
Acorn Montessori Charter School,138760000,"Acorn Montessori Charter School, Inc. - West",138760102,79437,88180,Regular or Provision 2/3 Base Year,122,0.6700
Adobe Mountain School,219101001,Adobe Mountain School,211001001,80381,8327,Regular or Provision 2/3 Base Year,5171,0.9900
Agua Fria Union High School District,070516000,Agua Fria High School,070516201,4289,5454,Regular or Provision 2/3 Base Year,1818,0.6000
Agua Fria Union High School District,070516000,Desert Edge High School,070516203,4289,79799,Regular or Provision 2/3 Base Year,1739,0.4600
Agua Fria Union High School District,070516000,Millennium High School,070516202,4289,78926,Regular or Provision 2/3 Base Year,2369,0.2800
Agua Fria Union High School District,070516000,Verrado High School,070516204,4289,87903,Regular or Provision 2/3 Base Year,2095,0.2200
Aguila Elementary District,070363000,Aguila Elementary School,070363101,4249,5187,Regular or Provision 2/3 Base Year,166,0.8700
AIBT Non-Profit Charter High School - Phoenix,078793000,RCB Medical Arts Academy,078793201,79053,79123,Regular or Provision 2/3 Base Year,169,0.9800
Ajo Unified District,100215000,Ajo Elementary School,100215001,4409,5831,Regular or Provision 2/3 Base Year,317,0.8200
Ajo Unified District,100215000,Ajo High School,100215002,4409,6292,Regular or Provision 2/3 Base Year,121,0.8700
Alhambra Elementary District,070468000,Alhambra Traditional School,070468101,4280,5381,Regular or Provision 2/3 Base Year,716,0.6200
Alhambra Elementary District,070468000,Andalucia Middle School,070468102,4280,5382,Regular or Provision 2/3 Base Year,1152,0.9100
Alhambra Elementary District,070468000,Barcelona Middle School,070468104,4280,5384,Regular or Provision 2/3 Base Year,711,0.9300
Alhambra Elementary District,070468000,Carol G. Peck Elementary School,070468105,4280,6030,Regular or Provision 2/3 Base Year,645,0.9700
Alhambra Elementary District,070468000,Catalina Ventura School,070468106,4280,5385,Regular or Provision 2/3 Base Year,1194,0.8900
Alhambra Elementary District,070468000,Cordova Elementary School,070468107,4280,5386,Regular or Provision 2/3 Base Year,892,0.9400
Alhambra Elementary District,070468000,Granada East School,070468109,4280,5387,Regular or Provision 2/3 Base Year,1102,0.9400
Alhambra Elementary District,070468000,Granada Primary School,070468110,4280,5388,Regular or Provision 2/3 Base Year,906,0.9500
Alhambra Elementary District,070468000,James W. Rice Primary School,070468103,4280,5383,Regular or Provision 2/3 Base Year,1027,0.9100
Alhambra Elementary District,070468000,Montebello School,070468111,4280,5389,Regular or Provision 2/3 Base Year,1253,0.9600
Alhambra Elementary District,070468000,R E Simpson School,070468113,4280,5391,Regular or Provision 2/3 Base Year,810,0.9300
Alhambra Elementary District,070468000,Sevilla Primary School,070468112,4280,5390,Regular or Provision 2/3 Base Year,896,0.9400
Alhambra Elementary District,070468000,Sevilla West School,070468115,4280,79203,Regular or Provision 2/3 Base Year,1189,0.9100
Alhambra Elementary District,070468000,Westwood Primary School,070468114,4280,5392,Regular or Provision 2/3 Base Year,842,0.9200
All Aboard Charter School,078967000,All Aboard Charter School,078967101,79969,79970,Regular or Provision 2/3 Base Year,142,0.7700
Altar Valley Elementary District,100351000,Altar Valley Middle School,100351103,4418,5859,Community Eligibility Provision,370,0.7600
Altar Valley Elementary District,100351000,Robles Elementary School,100351100,4418,84336,Community Eligibility Provision,367,0.9400
American Basic Schools LLC,078989000,Burke Basic School,078989101,79215,78788,Community Eligibility Provision,883,0.7600
American Charter Schools Foundation d.b.a. Alta Vista High School,108794000,Alta Vista High School,108794201,80995,80996,Provision 2 Non-Base Year,495,0.8400
American Charter Schools Foundation d.b.a. Apache Trail High School,118703000,Apache Trail High School,118703001,79883,6346,Community Eligibility Provision,166,0.8200
American Charter Schools Foundation d.b.a. Crestview College Preparatory High Sc,078950000,Crestview College Preparatory High School,078950001,79874,78813,Regular or Provision 2/3 Base Year,322,0.7700
American Charter Schools Foundation d.b.a. Desert Hills High School,078947000,Desert Hills High School,078947001,79872,78901,Regular or Provision 2/3 Base Year,228,0.5400
American Charter Schools Foundation d.b.a. Estrella High School,078948000,Estrella High School,078948001,79873,78900,Regular or Provision 2/3 Base Year,271,0.7300
American Charter Schools Foundation d.b.a. Peoria Accelerated High School,078951000,Peoria Accelerated High School,078951001,79875,78817,Regular or Provision 2/3 Base Year,520,0.7500
American Charter Schools Foundation d.b.a. South Pointe High School,078983000,South Pointe High School,078983201,80989,80990,Provision 2 Non-Base Year,486,0.9000
American Charter Schools Foundation d.b.a. South Ridge High School,078517000,South Ridge High School,078517201,88334,88335,Regular or Provision 2/3 Base Year,406,0.8400
American Charter Schools Foundation d.b.a. Sun Valley High School,078953000,Sun Valley High School,078953001,79877,6347,Provision 2 Non-Base Year,768,0.7800
American Charter Schools Foundation d.b.a. West Phoenix High School,078956000,West Phoenix High School,078956001,79879,6348,Community Eligibility Provision,457,0.9600
American Indian Christian Mission,092001000,American Indian Christian Mission,092001101,9655,80313,Community Eligibility Provision,25,0.9000
Amphitheater Unified District,100210000,Amphitheater High School,100210281,4406,6055,Regular or Provision 2/3 Base Year,1274,0.8000
Amphitheater Unified District,100210000,Amphitheater Middle School,100210166,4406,5805,Regular or Provision 2/3 Base Year,781,0.9000
Amphitheater Unified District,100210000,Canyon Del Oro High School,100210282,4406,5808,Regular or Provision 2/3 Base Year,1617,0.2500
Amphitheater Unified District,100210000,Copper Creek Elementary School,100210118,4406,5802,Regular or Provision 2/3 Base Year,496,0.2200
Amphitheater Unified District,100210000,Coronado K-8 School,100210115,4406,5799,Regular or Provision 2/3 Base Year,895,0.4100
Amphitheater Unified District,100210000,E C Nash School,100210110,4406,5796,Regular or Provision 2/3 Base Year,390,0.9400
Amphitheater Unified District,100210000,Frances Owen Holaway Elementary School,100210108,4406,5794,Regular or Provision 2/3 Base Year,417,0.8000
Amphitheater Unified District,100210000,Helen Keeling Elementary School,100210109,4406,5795,Regular or Provision 2/3 Base Year,417,0.9500
Amphitheater Unified District,100210000,Ironwood Ridge High School,100210280,4406,79378,Regular or Provision 2/3 Base Year,1794,0.1300
Amphitheater Unified District,100210000,L M Prince School,100210111,4406,5797,Regular or Provision 2/3 Base Year,634,0.9000
Amphitheater Unified District,100210000,La Cima Middle School,100210165,4406,5804,Regular or Provision 2/3 Base Year,493,0.8200
Amphitheater Unified District,100210000,Lawrence W Cross Middle School,100210167,4406,5806,Regular or Provision 2/3 Base Year,672,0.3300
Amphitheater Unified District,100210000,Lulu Walker School,100210112,4406,5798,Regular or Provision 2/3 Base Year,482,0.5800
Amphitheater Unified District,100210000,Marion Donaldson Elementary School,100210106,4406,5792,Regular or Provision 2/3 Base Year,321,0.5000
Amphitheater Unified District,100210000,Mesa Verde Elementary School,100210116,4406,5800,Regular or Provision 2/3 Base Year,375,0.4200
Amphitheater Unified District,100210000,Painted Sky Elementary School,100210114,4406,79282,Regular or Provision 2/3 Base Year,403,0.1700
Amphitheater Unified District,100210000,Richard B Wilson Jr School,100210168,4406,5807,Regular or Provision 2/3 Base Year,1229,0.1600
Amphitheater Unified District,100210000,Rillito Center,100210125,4406,5803,Regular or Provision 2/3 Base Year,77,0.5700
Amphitheater Unified District,100210000,Rio Vista Elementary School,100210117,4406,5801,Regular or Provision 2/3 Base Year,452,0.8500
Amphitheater Unified District,100210000,The Innovation Academy,100210119,4406,12976,Regular or Provision 2/3 Base Year,324,0.1700
Amphitheater Unified District,100210000,Winifred Harelson Elementary School,100210107,4406,5793,Regular or Provision 2/3 Base Year,526,0.1900
Antelope Union High School District,140550000,Antelope Union High School,140550201,4506,6188,Regular or Provision 2/3 Base Year,204,0.8200
Antelope Union High School District,140550000,AUHS Online Acadamy,140550101,4506,92739,Regular or Provision 2/3 Base Year,33,0.5450
Apache Junction Unified District,110243000,Apache Junction High School,110243201,4443,5925,Regular or Provision 2/3 Base Year,1121,0.4700
Apache Junction Unified District,110243000,Cactus Canyon Junior High,110243151,4443,5923,Regular or Provision 2/3 Base Year,624,0.6100
Apache Junction Unified District,110243000,Desert Vista Elementary School,110243104,4443,5922,Regular or Provision 2/3 Base Year,767,0.6400
Apache Junction Unified District,110243000,Four Peaks Elementary School,110243102,4443,5920,Regular or Provision 2/3 Base Year,709,0.7700
Apache Junction Unified District,110243000,Peralta Trail Elementary School,110243105,4443,79631,Regular or Provision 2/3 Base Year,490,0.6000
Aprender Tucson,108785000,Southside Community School,108785001,79426,79432,Community Eligibility Provision,260,0.9800
"Arizona Academy of Science And Technology, Inc.",078665000,Arizona Academy of Science and Technology,078665001,6378,10755,Regular or Provision 2/3 Base Year,39,0.7450
Arizona Community Development Corporation,108709000,La Paloma Academy,108709101,79947,79950,Regular or Provision 2/3 Base Year,732,0.6700
Arizona Community Development Corporation,108709000,La Paloma Academy (Lakeside),108709103,79947,81187,Regular or Provision 2/3 Base Year,833,0.6200
Arizona Community Development Corporation,108709000,La Paloma Academy-South,108709104,79947,91805,Regular or Provision 2/3 Base Year,396,0.8900
Arizona Cultural Academy,072006000,Arizona Cultural Academy,072006001,79812,79813,Regular or Provision 2/3 Base Year,342,0.4000
Arizona Montessori Charter School at Anthem,078991000,AMCS at Anthem dba Caurus Academy,078991101,85749,85750,Regular or Provision 2/3 Base Year,403,0.1300
Arizona State School for the Deaf and Blind,001202000,ASDB/Child Nutrition Program,001202058,6393,80462,Provision 2 Non-Base Year,149,0.7700
Arizona State School for the Deaf and Blind,001202000,PHX DAY SCH/MD,001202041,6393,6396,Provision 2 Non-Base Year,301,0.8400
Arlington Elementary District,070447000,Arlington Elementary School,070447101,4274,5354,Regular or Provision 2/3 Base Year,258,0.7800
Ash Creek Elementary District,020453000,Ash Creek Elementary,020453101,4187,4797,Community Eligibility Provision,20,0.8000
Ash Fork Joint Unified District,130231000,Ash Fork Elementary School,130231101,4471,6101,Provision 2 Non-Base Year,248,0.5600
ASPC - Tucson Minors Unit,219102200,Life Learning Academy,211002201,80380,92289,Regular or Provision 2/3 Base Year,53,0.9500
ASU Preparatory Academy,078250000,ASU Preparatory Academy - Phoenix Middle School,078250001,92325,92326,Regular or Provision 2/3 Base Year,358,0.5400
ASU Preparatory Academy,078546000,ASU Preparatory Academy- Phoenix Elementary,078546102,89949,90271,Regular or Provision 2/3 Base Year,384,0.7000
ASU Preparatory Academy,078207000,ASU Preparatory Academy- Phoenix High School,078207001,91303,91304,Regular or Provision 2/3 Base Year,390,0.5700
Avondale Elementary District,070444000,Avondale Middle School,070444112,4272,91985,Regular or Provision 2/3 Base Year,461,0.8300
Avondale Elementary District,070444000,Centerra Mirage STEM Academy,070444111,4272,87619,Regular or Provision 2/3 Base Year,551,0.6200
Avondale Elementary District,070444000,Copper Trails,070444110,4272,90028,Regular or Provision 2/3 Base Year,1070,0.4300
Avondale Elementary District,070444000,Desert Star,070444107,4272,79670,Regular or Provision 2/3 Base Year,734,0.6400
Avondale Elementary District,070444000,Desert Thunder,070444108,4272,79792,Regular or Provision 2/3 Base Year,792,0.5500
Avondale Elementary District,070444000,Eliseo C. Felix School,070444103,4272,5348,Regular or Provision 2/3 Base Year,540,0.9000
Avondale Elementary District,070444000,Lattie Coor,070444104,4272,5349,Regular or Provision 2/3 Base Year,423,0.8100
Avondale Elementary District,070444000,Michael Anderson,070444102,4272,5347,Regular or Provision 2/3 Base Year,904,0.9100
Avondale Elementary District,070444000,St. John Vianney Catholic School,072084001,4272,80181,Regular or Provision 2/3 Base Year,391,0.6800
Avondale Elementary District,070444000,Wildflower School,070444106,4272,78924,Regular or Provision 2/3 Base Year,543,0.6000
Az-Tec High School,148757000,AZTEC High School,148757001,4508,6192,Provision 2 Non-Base Year,132,0.9200
Baboquivari Unified School District #40,100240000,Alternative High School (Indian Oasis High School),100240205,4412,90822,Community Eligibility Provision,34,0.9000
Baboquivari Unified School District #40,100240000,Alternative Middle School (Indian Oasis Middle School),100240105,4412,90821,Community Eligibility Provision,14,0.8000
Baboquivari Unified School District #40,100240000,Baboquivari High School,100240204,4412,5847,Community Eligibility Provision,221,0.8900
Baboquivari Unified School District #40,100240000,Baboquivari Middle School,100240103,4412,5846,Community Eligibility Provision,150,0.8700
Baboquivari Unified School District #40,100240000,Indian Oasis Intermediate Elementary School,100240106,4412,948673,Community Eligibility Provision,236,0.9800
Baboquivari Unified School District #40,100240000,Indian Oasis Primary Elementary School,100240101,4412,5844,Community Eligibility Provision,449,0.9900
"Back To Life, Inc.",072785000,Roanoke House,072785001,90039,90040,Regular or Provision 2/3 Base Year,8,#VALUE!
"Back To Life, Inc.",072785000,Unity House,072785005,90039,90544,Regular or Provision 2/3 Base Year,10,0.8000
Bagdad Unified District,130220000,Bagdad Elementary School,130220101,4468,6088,Regular or Provision 2/3 Base Year,221,0.4500
Bagdad Unified District,130220000,Bagdad Middle / Senior High School,130220202,4468,6089,Regular or Provision 2/3 Base Year,204,0.4500
Ball Charter Schools (Dobson),078988000,"Dobson Academy, The - A Ball Charter School",078988102,79204,10729,Regular or Provision 2/3 Base Year,457,0.3900
Ball Charter Schools (Hearn),078987000,"Hearn Academy, The - A Ball Charter School",078987103,4294,10730,Regular or Provision 2/3 Base Year,676,0.4500
Balsz Elementary District,070431000,Balsz Elementary School,070431101,4268,5319,Community Eligibility Provision,980,0.9300
Balsz Elementary District,070431000,Brunson-Lee Elementary School,070431105,4268,81141,Community Eligibility Provision,398,0.9900
Balsz Elementary District,070431000,David Crockett Elementary School,070431102,4268,5320,Community Eligibility Provision,485,0.9900
Balsz Elementary District,070431000,Griffith Elementary School,070431103,4268,5321,Community Eligibility Provision,531,0.8300
Balsz Elementary District,070431000,Orangedale Early Learning Center,070431106,4268,92301,Community Eligibility Provision,85,0.4200
"BASIS Schools, Inc.",078282000,BASIS Phoenix South Primary,078282001,549803,139682,Regular or Provision 2/3 Base Year,203,0.6700
Beaver Creek Elementary District,130326000,Beaver Creek School,130326101,4481,6116,Regular or Provision 2/3 Base Year,350,0.6600
"Bell Canyon Charter School, Inc",078972000,Imagine Bell Canyon,078972101,79983,79507,Regular or Provision 2/3 Base Year,369,0.6400
Benson Unified School District,020209000,Benson High School,020209201,79226,4799,Regular or Provision 2/3 Base Year,452,0.3700
Benson Unified School District,020209000,Benson Middle School,020209102,79226,4794,Regular or Provision 2/3 Base Year,312,0.4800
Benson Unified School District,020209000,Benson Primary School,020209101,79226,4793,Regular or Provision 2/3 Base Year,648,0.5200
Benson Unified School District,020209000,San Pedro Valley High School,020209202,79226,85879,Regular or Provision 2/3 Base Year,29,0.6450
Bicentennial Union High School District,150576000,Salome High School,150576201,4515,6203,Provision 2 Non-Base Year,113,0.8200
Bisbee Unified District,020202000,Bisbee High School,020202201,4169,4754,Regular or Provision 2/3 Base Year,319,0.6500
Bisbee Unified District,020202000,Greenway Primary School,020202103,4169,4752,Regular or Provision 2/3 Base Year,218,0.7300
Bisbee Unified District,020202000,Lowell School,020202105,4169,4753,Regular or Provision 2/3 Base Year,204,0.6900
Black Mesa Community School,093901000,Black Mesa Community School,093901001,9688,80426,Community Eligibility Provision,49,0.9500
"Blackwater Community School, Inc.",114002000,Blackwater Community School,114002001,91760,91761,Community Eligibility Provision,384,0.9900
Blue Ridge Unified School District No. 32,090232000,Blue Ridge Elementary School,090232101,4397,5645,Regular or Provision 2/3 Base Year,1150,0.5300
Blue Ridge Unified School District No. 32,090232000,Blue Ridge High School,090232204,4397,5648,Regular or Provision 2/3 Base Year,823,0.4100
Blue Ridge Unified School District No. 32,090232000,Blue Ridge Jr High School,090232103,4397,5647,Regular or Provision 2/3 Base Year,405,0.5500
Bonita Elementary District,050316000,Bonita Elementary School,050316101,4224,4896,Regular or Provision 2/3 Base Year,85,0.5200
Bouse Elementary District,150426000,Bouse Elementary School,150426101,4513,6201,Regular or Provision 2/3 Base Year,25,0.7450
Bowie Unified District,020214000,Bowie Elementary School,020214100,4171,4758,Regular or Provision 2/3 Base Year,39,0.9000
Bowie Unified District,020214000,Bowie High School,020214200,4171,4759,Regular or Provision 2/3 Base Year,24,0.9000
Boys & Girls Clubs of the East Valley dba Mesa Arts Academy,078613000,Mesa Arts Academy,078613101,4305,5470,Regular or Provision 2/3 Base Year,237,0.8000
"Bradley Academy of Excellence, Inc.",078746000,Bradley Academy of Excellence,078746101,81097,81098,Regular or Provision 2/3 Base Year,723,0.9700
Buckeye Elementary District,070433000,Bales Elementary School,070433102,4269,81110,Community Eligibility Provision,792,0.7600
Buckeye Elementary District,070433000,Buckeye Elementary School,070433109,4269,87473,Community Eligibility Provision,883,0.9800
Buckeye Elementary District,070433000,Inca Elementary School,070433107,4269,90341,Community Eligibility Provision,766,0.5500
Buckeye Elementary District,070433000,Marionneaux Elementary School,070433106,4269,527220,Community Eligibility Provision,741,0.4600
Buckeye Elementary District,070433000,Steven R. Jasinski Elementary School,070433104,4269,89572,Community Eligibility Provision,480,0.7500
Buckeye Elementary District,070433000,Sundance Elementary,070433105,4269,87471,Community Eligibility Provision,772,0.5500
Buckeye Elementary District,070433000,Westpark Elementary School,070433103,4269,88398,Community Eligibility Provision,728,0.5500
Buckeye Union High School District,070501000,Buckeye Union High School,070501201,4284,5424,Regular or Provision 2/3 Base Year,1557,0.6400
Buckeye Union High School District,070501000,Estrella Foothills High School,070501202,4284,79376,Regular or Provision 2/3 Base Year,1102,0.3300
Buckeye Union High School District,070501000,Youngker High School,070501204,4284,89573,Regular or Provision 2/3 Base Year,1711,0.6000
Bullhead City School District,080415000,Bullhead City Jr High School,080415130,4378,5587,Community Eligibility Provision,437,0.8900
Bullhead City School District,080415000,Coyote Canyon School,080415103,4378,5583,Community Eligibility Provision,543,0.9900
Bullhead City School District,080415000,Desert Valley School,080415105,4378,5584,Community Eligibility Provision,474,0.9900
Bullhead City School District,080415000,Diamondback Elementary School,080415107,4378,5585,Community Eligibility Provision,602,0.7200
Bullhead City School District,080415000,Fox Creek Jr High School,080415110,4378,6048,Community Eligibility Provision,491,0.6600
Bullhead City School District,080415000,Sunrise Elementary,080415104,4378,79655,Community Eligibility Provision,385,0.7900
"CAFA, Inc. dba Learning Foundation and Performing Arts Alta Mesa",078565000,Learning Foundation and Performing Arts Alta Mesa,078565001,90328,88290,Regular or Provision 2/3 Base Year,238,0.7500
"CAFA, Inc. dba Learning Foundation and Performing Arts Gilbert",078564000,Learning Foundation and Performing Arts Gilbert,078564001,90327,88289,Regular or Provision 2/3 Base Year,459,0.3000
"CAFA, Inc. dba Learning Foundation and Performing Arts Gilbert",078564000,Learning Foundation and Performing Arts Warner,078564002,90327,92235,Regular or Provision 2/3 Base Year,444,0.3900
"CAFA, Inc. dba Learning Foundation Performing Arts School",098749000,Learning Foundation,098749002,79971,81102,Regular or Provision 2/3 Base Year,198,0.8700
Calibre Academy,078909000,Calibre Academy Surprise,078909102,79055,80463,Regular or Provision 2/3 Base Year,536,0.4300
"Camelback Education, Inc",078959000,Camelback Academy,078959001,79905,79906,Regular or Provision 2/3 Base Year,566,0.8600
Camp Verde Unified District,130228000,Camp Verde Accommodation School,130228304,4470,84659,Regular or Provision 2/3 Base Year,28,0.6450
Camp Verde Unified District,130228000,Camp Verde Elementary School,130228101,4470,6098,Regular or Provision 2/3 Base Year,648,0.6300
Camp Verde Unified District,130228000,Camp Verde High School,130228203,4470,6100,Regular or Provision 2/3 Base Year,489,0.4400
Camp Verde Unified District,130228000,Camp Verde Middle School,130228102,4470,6099,Regular or Provision 2/3 Base Year,359,0.6500
Camp Verde Unified District,130228000,South Verde Technology Magnet,130228204,4470,90137,Regular or Provision 2/3 Base Year,31,0.6450
Canon Elementary District,130350000,Canon School,130350101,4484,6119,Regular or Provision 2/3 Base Year,148,0.8200
Canyon State Academy,072107000,Canyon State Academy,072107001,79302,79303,Regular or Provision 2/3 Base Year,314,0.9900
Canyon State Academy,072107000,Sycamore Canyon Ctr for Youth,072107002,79302,89565,Regular or Provision 2/3 Base Year,23,0.9000
"Career Development, Inc.",098745000,Northern AZ Academy for Career Dev. - Taylor,098745204,4400,5652,Community Eligibility Provision,54,0.9200
Cartwright Elementary District,070483000,Bret R. Tarver,070483122,4282,79283,Provision 2 Non-Base Year,724,0.9100
Cartwright Elementary District,070483000,Byron A. Barry School,070483117,4282,5414,Regular or Provision 2/3 Base Year,553,0.6700
Cartwright Elementary District,070483000,Cartwright School,070483101,4282,5398,Provision 2 Non-Base Year,783,0.9200
Cartwright Elementary District,070483000,Charles W. Harris School,070483108,4282,5405,Provision 2 Non-Base Year,1195,0.6700
Cartwright Elementary District,070483000,Desert Sands Middle School,070483109,4282,5406,Provision 2 Non-Base Year,1077,0.8600
Cartwright Elementary District,070483000,Estrella Middle School,070483114,4282,5411,Provision 2 Non-Base Year,1263,0.8400
Cartwright Elementary District,070483000,Frank Borman School,070483110,4282,5407,Provision 2 Non-Base Year,1105,0.8700
Cartwright Elementary District,070483000,G. Frank Davidson,070483120,4282,6032,Provision 2 Non-Base Year,690,0.8800
Cartwright Elementary District,070483000,Glenn L. Downs School,070483102,4282,5399,Provision 2 Non-Base Year,726,0.9600
Cartwright Elementary District,070483000,Heatherbrae School,070483112,4282,5409,Provision 2 Non-Base Year,750,0.9200
Cartwright Elementary District,070483000,Holiday Park School,070483105,4282,5402,Provision 2 Non-Base Year,666,0.8900
Cartwright Elementary District,070483000,John F. Long,070483103,4282,5400,Provision 2 Non-Base Year,770,0.9200
Cartwright Elementary District,070483000,Justine Spitalny School,070483104,4282,5401,Provision 2 Non-Base Year,574,0.9200
Cartwright Elementary District,070483000,Manuel Pena Jr. School,070483123,4282,81109,Provision 2 Non-Base Year,753,0.8700
Cartwright Elementary District,070483000,Marc T. Atkinson Middle School,070483121,4282,78980,Provision 2 Non-Base Year,1287,0.8600
Cartwright Elementary District,070483000,Palm Lane,070483115,4282,5412,Provision 2 Non-Base Year,863,0.9200
